<?xml version="1.0" encoding="UTF-8"?>
<!--?DOCTYPE TEI SYSTEM "http://projects.oucs.ox.ac.uk/ENRICH/ODD/RomaResults/enrich.dtd" -->
<!DOCTYPE TEI SYSTEM "halfway.dtd">
<?xml-stylesheet type="text/xsl" href="student.xsl"?>
<?xml-stylesheet type="text/css" href="classes.css"?>
<TEI>
<teiHeader>
<fileDesc>
<titleStmt>
<title>London, British Library, Harley MS 4431</title>
<author>Christine de Pizan</author>
<respStmt>
<resp>Marked up by</resp><name>Team funded under AHRC 
award</name>
</respStmt></titleStmt>
<publicationStmt>
<authority>AHRC funded research project in Middle French 2004 to 2009 
contact James.Laidlaw
at ed.ac.uk</authority>
<availability 
status="free"><p>http://www.pizan.lib.ed.ac.uk/</p></availability>
<date>2008</date>
</publicationStmt>
<sourceDesc>
<biblFull>
<titleStmt>
<title>The Queen's Manuscript</title>
<author>Christine de Pizan</author>
</titleStmt>
<publicationStmt>
<publisher>Manuscript</publisher>
<pubPlace>Paris</pubPlace>
<date>1414</date>
<idno 
type="url">http://www.bl.uk/catalogues/illuminatedmanuscripts</idno>
</publicationStmt></biblFull>
</sourceDesc></fileDesc>
</teiHeader>
<text>
<body>
<p>



</p>
</body>
</text>
</TEI>