<?xml version="1.0" encoding="UTF-8"?>
<!--?DOCTYPE TEI SYSTEM "http://www.tei-c.org/release/xml/tei/custom/schema/dtd/tei_all.dtd" -->
<!DOCTYPE TEI SYSTEM "halfway.dtd">
<?xml-stylesheet href="fiche.xsl" type="text/xsl"?>
<TEI>
<teiHeader>
<fileDesc>
<titleStmt>
<title>London, British Library, Harley MS 4431</title>
<author>Christine de Pizan</author>
<respStmt>
<resp>Marked up by</resp><name>Team funded under AHRC award</name>
</respStmt></titleStmt>
<publicationStmt>
<authority>AHRC funded research project (2004-2009) centred on London, British Library, Harley MS 4431, the collection of her works prepared by Christine de Pizan and presented by her to Queen Isabeau of France early in 1414.  Contact Charlie.Mansfield@ ed.ac.uk</authority>
<availability status="free"><p>http://www.pizan.lib.ed.ac.uk/</p></availability>
<date>2008</date>
</publicationStmt>
<sourceDesc>
<biblFull>
<titleStmt>
<title>The Queen's Manuscript</title>
<author>Christine de Pizan</author>
</titleStmt>
<publicationStmt>
<publisher>Manuscript</publisher>
<pubPlace>Paris</pubPlace>
<date>1414</date>
<idno type="url">http://www.bl.uk/catalogues/illuminatedmanuscripts</idno>
</publicationStmt></biblFull>
</sourceDesc></fileDesc>
</teiHeader>
<text>
<body>
<p>
<div1 n="1" type="1">

<div9>
<div4><title type="main"><emph rend="headline">Cent Balades</emph></title></div4>
<div4>The ruling of ff. 4-11 makes no provision for running titles.</div4>

</div9>

</div1>
</p>
</body>
</text>
</TEI>


