<?xml version="1.0" encoding="UTF-8"?>
<!--?DOCTYPE TEI SYSTEM "http://www.tei-c.org/release/xml/tei/custom/schema/dtd/tei_all.dtd" -->
<!DOCTYPE TEI SYSTEM "halfway.dtd">
<?xml-stylesheet href="fiche.xsl" type="text/xsl"?>
<?xml-stylesheet type="text/css" href="classes.css"?>
<TEI>
<teiHeader>
<fileDesc>
<titleStmt>
<title>London, British Library, Harley MS 4431</title>
<author>Christine de Pizan</author>
<respStmt>
<resp>Marked up by</resp><name>Team funded under AHRC award</name>
</respStmt></titleStmt>
<publicationStmt>
<authority>AHRC funded research project (2004-2009) centred on London, British Library, Harley MS 4431, the collection of her works prepared by Christine de Pizan and presented by her to Queen Isabeau of France early in 1414.  Contact Charlie.Mansfield@ ed.ac.uk</authority>
<availability status="free"><p>http://www.pizan.lib.ed.ac.uk/</p></availability>
<date>2008</date>
</publicationStmt>
<sourceDesc>
<biblFull>
<titleStmt>
<title>The Queen's Manuscript</title>
<author>Christine de Pizan</author>
</titleStmt>
<publicationStmt>
<publisher>Manuscript</publisher>
<pubPlace>Paris</pubPlace>
<date>1414</date>
<idno type="url">http://www.bl.uk/catalogues/illuminatedmanuscripts</idno>
</publicationStmt></biblFull>
</sourceDesc></fileDesc>
</teiHeader>
<text>
<body>
<p>
<div1 n="1" type="1">
<div9>
<div4><title type="main"><emph rend="headline">Complainte Amoureuse</emph></title></div4>
<div4>Harley MS 4431 contains the only known copy of the <emph rend="italic">Complainte Amoureuse</emph>. The unusual structure of Quire 5 shows that the <emph rend="italic">Complainte</emph>, like <emph rend="italic">Encore Aultres Balades</emph>, the item immediately following, was added to the Queen's MS at the very last minute.</div4>
<div4>The <emph rend="italic">Complainte</emph> is introduced by a miniature and a rubric; there is only one running title, on fol. 49r. The poem is made up of 12 seizains, rhyming <emph rend="italic">a10a10a10b4b10b10b10c4c10c10c10d4d10d10d10e4e10e10e10f4</emph> etc. The opening line of each stanza is set off: by a champie initial with a border (Stanza 1) or by a paragraph mark (Stanzas 2-12); unusually, Stanza 9 contains a second paragraph mark, at line 135. A blank line has been left after each stanza, except after Stanzas 2 and 11. Lines 149-51 have been copied twice; the second version is scored through by a single vertical line.</div4>
</div9>
</div1>
</p>
</body>
</text>
</TEI>